--
-- GLOBAL index tests
--
CREATE TABLE range_parted (
	a int,
	b int
) PARTITION BY RANGE (a);
--create some partitions and insert data
CREATE TABLE range_parted_1 PARTITION OF range_parted FOR VALUES FROM (1) TO (100000);
CREATE TABLE range_parted_2 PARTITION OF range_parted FOR VALUES FROM (100000) TO (200000);
CREATE TABLE range_parted_3 PARTITION OF range_parted FOR VALUES FROM (200000) TO (300000);
INSERT INTO range_parted SELECT i,i%100 FROM generate_series(1,299999) AS i;
--Create global index
CREATE INDEX global_idx ON range_parted(b) global;
INSERT INTO range_parted SELECT i,i%200 FROM generate_series(1,299999) AS i;
EXPLAIN (COSTS OFF) SELECT * FROM range_parted WHERE b = 7;
                     QUERY PLAN                     
----------------------------------------------------
 Global Index Scan using global_idx on range_parted
   Index Cond: (b = 7)
(2 rows)

SELECT * FROM range_parted WHERE b = 7 LIMIT 10;
  a  | b 
-----+---
   7 | 7
 107 | 7
 207 | 7
 307 | 7
 407 | 7
 507 | 7
 607 | 7
 707 | 7
 807 | 7
 907 | 7
(10 rows)

EXPLAIN (COSTS OFF) SELECT * FROM range_parted WHERE b = 110;
                     QUERY PLAN                     
----------------------------------------------------
 Global Index Scan using global_idx on range_parted
   Index Cond: (b = 110)
(2 rows)

SELECT * FROM range_parted WHERE b = 110 LIMIT 10;
  a   |  b  
------+-----
  110 | 110
  310 | 110
  510 | 110
  710 | 110
  910 | 110
 1110 | 110
 1310 | 110
 1510 | 110
 1710 | 110
 1910 | 110
(10 rows)

SELECT * FROM range_parted WHERE b = 250 LIMIT 10;
 a | b 
---+---
(0 rows)

UPDATE range_parted SET b=b+100;
EXPLAIN (COSTS OFF) SELECT * FROM range_parted WHERE b = 250;
                     QUERY PLAN                     
----------------------------------------------------
 Global Index Scan using global_idx on range_parted
   Index Cond: (b = 250)
(2 rows)

SELECT * FROM range_parted WHERE b = 250 LIMIT 10;
  a   |  b  
------+-----
  150 | 250
  350 | 250
  550 | 250
  750 | 250
  950 | 250
 1150 | 250
 1350 | 250
 1550 | 250
 1750 | 250
 1950 | 250
(10 rows)

--attach partition
CREATE TABLE range_parted_4(a int, b int);
INSERT INTO range_parted_4 SELECT i,i%300 + 100 FROM generate_series(300000,300300) as i;
ALTER TABLE range_parted ATTACH PARTITION range_parted_4 FOR VALUES FROM (300000) to (400000);
EXPLAIN (COSTS OFF) SELECT * FROM range_parted WHERE b = 350;
                     QUERY PLAN                     
----------------------------------------------------
 Global Index Scan using global_idx on range_parted
   Index Cond: (b = 350)
(2 rows)

SELECT * FROM range_parted WHERE b = 350 LIMIT 10;
   a    |  b  
--------+-----
 300250 | 350
(1 row)

CREATE TABLE range_parted_5(a int, b int) PARTITION BY RANGE (a);
CREATE TABLE range_parted_5_1 PARTITION OF range_parted_5 FOR VALUES FROM (400000) TO (450000);
CREATE TABLE range_parted_5_2 PARTITION OF range_parted_5 FOR VALUES FROM (450000) TO (460000);
INSERT INTO range_parted_5 SELECT i,i%100 + 500 FROM generate_series(400000,459999) AS i;
CREATE INDEX global_idx_1 ON range_parted_5(b) global;
EXPLAIN (COSTS OFF) SELECT * FROM range_parted_5 WHERE b = 550;
                       QUERY PLAN                       
--------------------------------------------------------
 Global Index Scan using global_idx_1 on range_parted_5
   Index Cond: (b = 550)
(2 rows)

SELECT * FROM range_parted_5 WHERE b = 550 LIMIT 5;
   a    |  b  
--------+-----
 400050 | 550
 400150 | 550
 400250 | 550
 400350 | 550
 400450 | 550
(5 rows)

--attach to the top partition
ALTER TABLE range_parted ATTACH PARTITION range_parted_5 FOR VALUES FROM (400000) to (500000);
EXPLAIN (COSTS OFF) SELECT * FROM range_parted WHERE b = 550;
                     QUERY PLAN                     
----------------------------------------------------
 Global Index Scan using global_idx on range_parted
   Index Cond: (b = 550)
(2 rows)

SELECT * FROM range_parted WHERE b = 550 LIMIT 5;
   a    |  b  
--------+-----
 400050 | 550
 400150 | 550
 400250 | 550
 400350 | 550
 400450 | 550
(5 rows)

-- Check index only scan
EXPLAIN (COSTS OFF) SELECT b FROM range_parted WHERE b = 550 LIMIT 5;
                          QUERY PLAN                           
---------------------------------------------------------------
 Limit
   ->  Global Index Only Scan using global_idx on range_parted
         Index Cond: (b = 550)
(3 rows)

SELECT b FROM range_parted WHERE b = 550 LIMIT 5;
  b  
-----
 550
 550
 550
 550
 550
(5 rows)

-- Attach to level-1 partition (test with multi level global index)
CREATE TABLE range_parted_6(a int, b int);
INSERT INTO range_parted_6 SELECT i,i%100 + 600 FROM generate_series(460000,490000) AS i;
ALTER TABLE range_parted_5 ATTACH PARTITION range_parted_6 FOR VALUES FROM (460000) to (500000);
EXPLAIN (COSTS OFF) SELECT * FROM range_parted WHERE b = 650;
                     QUERY PLAN                     
----------------------------------------------------
 Global Index Scan using global_idx on range_parted
   Index Cond: (b = 650)
(2 rows)

SELECT * FROM range_parted WHERE b = 650 LIMIT 5;
   a    |  b  
--------+-----
 460050 | 650
 460150 | 650
 460250 | 650
 460350 | 650
 460450 | 650
(5 rows)

-- Update the leaf and check we are inserting that in multi-level global index
UPDATE range_parted SET b=b+1000;
EXPLAIN (COSTS OFF) SELECT * FROM range_parted WHERE b = 1650;
                     QUERY PLAN                     
----------------------------------------------------
 Global Index Scan using global_idx on range_parted
   Index Cond: (b = 1650)
(2 rows)

SELECT * FROM range_parted WHERE b = 1650 LIMIT 5;
   a    |  b   
--------+------
 460050 | 1650
 460150 | 1650
 460250 | 1650
 460350 | 1650
 460450 | 1650
(5 rows)

EXPLAIN (COSTS OFF) SELECT * FROM range_parted_5 WHERE b = 1650;
                       QUERY PLAN                       
--------------------------------------------------------
 Global Index Scan using global_idx_1 on range_parted_5
   Index Cond: (b = 1650)
(2 rows)

SELECT * FROM range_parted_5 WHERE b = 1650 LIMIT 5;
   a    |  b   
--------+------
 460050 | 1650
 460150 | 1650
 460250 | 1650
 460350 | 1650
 460450 | 1650
(5 rows)

-- Conditional update using global index
EXPLAIN (COSTS OFF) UPDATE range_parted SET b=b+1000 where b = 1650;
                        QUERY PLAN                        
----------------------------------------------------------
 Update on range_parted
   Update on range_parted_1 range_parted
   Update on range_parted_2 range_parted
   Update on range_parted_3 range_parted
   Update on range_parted_4 range_parted
   Update on range_parted_5_1 range_parted
   Update on range_parted_5_2 range_parted
   Update on range_parted_6 range_parted
   ->  Global Index Scan using global_idx on range_parted
         Index Cond: (b = 1650)
(10 rows)

UPDATE range_parted SET b=b+1000 where b = 1650;
EXPLAIN (COSTS OFF) SELECT * FROM range_parted_5 WHERE b = 2650;
                       QUERY PLAN                       
--------------------------------------------------------
 Global Index Scan using global_idx_1 on range_parted_5
   Index Cond: (b = 2650)
(2 rows)

SELECT * FROM range_parted_5 WHERE b = 2650 LIMIT 5;
   a    |  b   
--------+------
 460050 | 2650
 460150 | 2650
 460250 | 2650
 460350 | 2650
 460450 | 2650
(5 rows)

--Detach partition
ALTER TABLE range_parted DETACH PARTITION range_parted_5;
EXPLAIN (COSTS OFF) SELECT * FROM range_parted WHERE b = 550;
                     QUERY PLAN                     
----------------------------------------------------
 Global Index Scan using global_idx on range_parted
   Index Cond: (b = 550)
(2 rows)

SELECT * FROM range_parted WHERE b = 550 LIMIT 5;
 a | b 
---+---
(0 rows)

--Reattach the partition
ALTER TABLE range_parted ATTACH PARTITION range_parted_5 FOR VALUES FROM (400000) to (500000);
EXPLAIN (COSTS OFF) SELECT * FROM range_parted WHERE b = 550;
                     QUERY PLAN                     
----------------------------------------------------
 Global Index Scan using global_idx on range_parted
   Index Cond: (b = 550)
(2 rows)

SELECT * FROM range_parted WHERE b = 550 LIMIT 5;
 a | b 
---+---
(0 rows)

--Drop the partitioned table
DROP TABLE range_parted_5;
EXPLAIN (COSTS OFF) SELECT * FROM range_parted WHERE b = 550;
                     QUERY PLAN                     
----------------------------------------------------
 Global Index Scan using global_idx on range_parted
   Index Cond: (b = 550)
(2 rows)

SELECT * FROM range_parted WHERE b = 550 LIMIT 5;
 a | b 
---+---
(0 rows)

-- Test unique global index
TRUNCATE TABLE range_parted;
INSERT INTO range_parted VALUES(1,2);
INSERT INTO range_parted VALUES(2,2);
CREATE UNIQUE INDEX global_idx_unique ON range_parted(b) global; -- Fail with duplicate
ERROR:  could not create unique index "global_idx_unique"
DETAIL:  Key (b, )=(2, 1) is duplicated.
TRUNCATE TABLE range_parted;
INSERT INTO range_parted VALUES(1,2);
CREATE UNIQUE INDEX global_idx_unique ON range_parted(b) global;
INSERT INTO range_parted VALUES(1,2); -- Fail with duplicate
ERROR:  duplicate key value violates unique constraint "global_idx_unique"
DETAIL:  Key (b, )=(2, 1) already exists.
DROP INDEX global_idx_unique;
INSERT INTO range_parted VALUES(1,2); -- Now this should pass
-- multiple level multiple type partitions
CREATE TABLE parent_table (
    id INT,
    category TEXT,
    sub_category TEXT,
    value INT
) PARTITION BY RANGE (id);
DO $$
DECLARE
    range_start INT;
    range_end INT;
    range_partition_name TEXT;
    list_partition_name TEXT;
    hash_partition_name TEXT;
    i INT;
    j INT;
    k INT;
BEGIN
    -- Create range partitions
    FOR i IN 0..10 LOOP
        range_start := i * 1000;
        range_end := (i + 1) * 1000;
        range_partition_name := format('parent_table_%s', i);
        EXECUTE format('CREATE TABLE %I PARTITION OF parent_table FOR VALUES FROM (%s) TO (%s) PARTITION BY LIST(category)', range_partition_name, range_start, range_end);

        -- Create list partitions within each range partition
        FOR j IN 1..10 LOOP
            list_partition_name := format('%s_list_%s', range_partition_name, j);
            EXECUTE format('CREATE TABLE %I PARTITION OF %I FOR VALUES IN (''%s'') PARTITION BY HASH (id)', list_partition_name, range_partition_name, j);

            -- Create hash partitions within each list partition
            FOR k IN 0..4 LOOP
                hash_partition_name := format('%s_hash_%s', list_partition_name, k);
                EXECUTE format('CREATE TABLE %I PARTITION OF %I FOR VALUES WITH (MODULUS 5, REMAINDER %s)', hash_partition_name, list_partition_name, k);
            END LOOP;
        END LOOP;
    END LOOP;
END $$;
DO $$
DECLARE
    i INT := 1;
BEGIN
    WHILE i <= 10000 LOOP
        INSERT INTO parent_table (id, category, sub_category, value)
        VALUES (i, '' || (i % 10 + 1), '' || (i % 10 + 1), i);
        i := i + 1;
    END LOOP;
END $$;
CREATE INDEX global_index_v ON parent_table(value) global;
EXPLAIN (COSTS OFF) SELECT * FROM parent_table WHERE value = 9000;
                       QUERY PLAN                       
--------------------------------------------------------
 Global Index Scan using global_index_v on parent_table
   Index Cond: (value = 9000)
(2 rows)

SELECT * FROM parent_table WHERE value = 9000;
  id  | category | sub_category | value 
------+----------+--------------+-------
 9000 | 1        | 1            |  9000
(1 row)

-- Cleanup
DROP TABLE range_parted;
DROP TABLE parent_table;
--Multilevel partition test
CREATE TABLE parent_table (
    id INT,
    category TEXT,
    sub_category TEXT,
    value INT
) PARTITION BY RANGE (id);
DO $$
DECLARE
    range_start INT;
    range_end INT;
    range_partition_name TEXT;
    list_partition_name TEXT;
    hash_partition_name TEXT;
    i INT;
    j INT;
    k INT;
BEGIN
    -- Create range partitions
    FOR i IN 0..2 LOOP
        range_start := i * 1000;
        range_end := (i + 1) * 1000;
        range_partition_name := format('parent_table_%s', i);
        EXECUTE format('CREATE TABLE %I PARTITION OF parent_table FOR VALUES FROM (%s) TO (%s) PARTITION BY LIST(category)', range_partition_name, range_start, range_end);

        -- Create list partitions within each range partition
        FOR j IN 1..2 LOOP
            list_partition_name := format('%s_list_%s', range_partition_name, j);
            EXECUTE format('CREATE TABLE %I PARTITION OF %I FOR VALUES IN (''%s'') PARTITION BY HASH (id)', list_partition_name, range_partition_name, j);

            -- Create hash partitions within each list partition
            FOR k IN 0..2 LOOP
                hash_partition_name := format('%s_hash_%s', list_partition_name, k);
                EXECUTE format('CREATE TABLE %I PARTITION OF %I FOR VALUES WITH (MODULUS 3, REMAINDER %s)', hash_partition_name, list_partition_name, k);
            END LOOP;
        END LOOP;
    END LOOP;
END $$;
DO $$
DECLARE
    i INT := 1;
BEGIN
    WHILE i <= 2999 LOOP
        INSERT INTO parent_table (id, category, sub_category, value)
        VALUES (i, '' || (i % 2 + 1), '' || (i % 10 + 1), i);
        i := i + 1;
    END LOOP;
END $$;
CREATE INDEX global_index_pt on parent_table(category) global;
SELECT indexrelid::regclass, indrelid::regclass, indtoprelid::regclass, indtopindexid::regclass FROM pg_index WHERE indtopindexid::regclass ='global_index_pt'::regclass;
                indexrelid                 |           indrelid           | indtoprelid  |  indtopindexid  
-------------------------------------------+------------------------------+--------------+-----------------
 parent_table_0_category_idx               | parent_table_0               | parent_table | global_index_pt
 parent_table_0_list_1_category_idx        | parent_table_0_list_1        | parent_table | global_index_pt
 parent_table_0_list_1_hash_0_category_idx | parent_table_0_list_1_hash_0 | parent_table | global_index_pt
 parent_table_0_list_1_hash_1_category_idx | parent_table_0_list_1_hash_1 | parent_table | global_index_pt
 parent_table_0_list_1_hash_2_category_idx | parent_table_0_list_1_hash_2 | parent_table | global_index_pt
 parent_table_0_list_2_category_idx        | parent_table_0_list_2        | parent_table | global_index_pt
 parent_table_0_list_2_hash_0_category_idx | parent_table_0_list_2_hash_0 | parent_table | global_index_pt
 parent_table_0_list_2_hash_1_category_idx | parent_table_0_list_2_hash_1 | parent_table | global_index_pt
 parent_table_0_list_2_hash_2_category_idx | parent_table_0_list_2_hash_2 | parent_table | global_index_pt
 parent_table_1_category_idx               | parent_table_1               | parent_table | global_index_pt
 parent_table_1_list_1_category_idx        | parent_table_1_list_1        | parent_table | global_index_pt
 parent_table_1_list_1_hash_0_category_idx | parent_table_1_list_1_hash_0 | parent_table | global_index_pt
 parent_table_1_list_1_hash_1_category_idx | parent_table_1_list_1_hash_1 | parent_table | global_index_pt
 parent_table_1_list_1_hash_2_category_idx | parent_table_1_list_1_hash_2 | parent_table | global_index_pt
 parent_table_1_list_2_category_idx        | parent_table_1_list_2        | parent_table | global_index_pt
 parent_table_1_list_2_hash_0_category_idx | parent_table_1_list_2_hash_0 | parent_table | global_index_pt
 parent_table_1_list_2_hash_1_category_idx | parent_table_1_list_2_hash_1 | parent_table | global_index_pt
 parent_table_1_list_2_hash_2_category_idx | parent_table_1_list_2_hash_2 | parent_table | global_index_pt
 parent_table_2_category_idx               | parent_table_2               | parent_table | global_index_pt
 parent_table_2_list_1_category_idx        | parent_table_2_list_1        | parent_table | global_index_pt
 parent_table_2_list_1_hash_0_category_idx | parent_table_2_list_1_hash_0 | parent_table | global_index_pt
 parent_table_2_list_1_hash_1_category_idx | parent_table_2_list_1_hash_1 | parent_table | global_index_pt
 parent_table_2_list_1_hash_2_category_idx | parent_table_2_list_1_hash_2 | parent_table | global_index_pt
 parent_table_2_list_2_category_idx        | parent_table_2_list_2        | parent_table | global_index_pt
 parent_table_2_list_2_hash_0_category_idx | parent_table_2_list_2_hash_0 | parent_table | global_index_pt
 parent_table_2_list_2_hash_1_category_idx | parent_table_2_list_2_hash_1 | parent_table | global_index_pt
 parent_table_2_list_2_hash_2_category_idx | parent_table_2_list_2_hash_2 | parent_table | global_index_pt
(27 rows)

CREATE INDEX global_index_pt_0 on parent_table_0(sub_category) global;
CREATE UNIQUE INDEX global_index_pt_l_2 on parent_table_2_list_2(value) global;
SELECT indexrelid::regclass, indrelid::regclass, indtoprelid::regclass, indtopindexid::regclass FROM pg_index WHERE indtopindexid::regclass ='global_index_pt'::regclass;
                indexrelid                 |           indrelid           | indtoprelid  |  indtopindexid  
-------------------------------------------+------------------------------+--------------+-----------------
 parent_table_0_category_idx               | parent_table_0               | parent_table | global_index_pt
 parent_table_0_list_1_category_idx        | parent_table_0_list_1        | parent_table | global_index_pt
 parent_table_0_list_1_hash_0_category_idx | parent_table_0_list_1_hash_0 | parent_table | global_index_pt
 parent_table_0_list_1_hash_1_category_idx | parent_table_0_list_1_hash_1 | parent_table | global_index_pt
 parent_table_0_list_1_hash_2_category_idx | parent_table_0_list_1_hash_2 | parent_table | global_index_pt
 parent_table_0_list_2_category_idx        | parent_table_0_list_2        | parent_table | global_index_pt
 parent_table_0_list_2_hash_0_category_idx | parent_table_0_list_2_hash_0 | parent_table | global_index_pt
 parent_table_0_list_2_hash_1_category_idx | parent_table_0_list_2_hash_1 | parent_table | global_index_pt
 parent_table_0_list_2_hash_2_category_idx | parent_table_0_list_2_hash_2 | parent_table | global_index_pt
 parent_table_1_category_idx               | parent_table_1               | parent_table | global_index_pt
 parent_table_1_list_1_category_idx        | parent_table_1_list_1        | parent_table | global_index_pt
 parent_table_1_list_1_hash_0_category_idx | parent_table_1_list_1_hash_0 | parent_table | global_index_pt
 parent_table_1_list_1_hash_1_category_idx | parent_table_1_list_1_hash_1 | parent_table | global_index_pt
 parent_table_1_list_1_hash_2_category_idx | parent_table_1_list_1_hash_2 | parent_table | global_index_pt
 parent_table_1_list_2_category_idx        | parent_table_1_list_2        | parent_table | global_index_pt
 parent_table_1_list_2_hash_0_category_idx | parent_table_1_list_2_hash_0 | parent_table | global_index_pt
 parent_table_1_list_2_hash_1_category_idx | parent_table_1_list_2_hash_1 | parent_table | global_index_pt
 parent_table_1_list_2_hash_2_category_idx | parent_table_1_list_2_hash_2 | parent_table | global_index_pt
 parent_table_2_category_idx               | parent_table_2               | parent_table | global_index_pt
 parent_table_2_list_1_category_idx        | parent_table_2_list_1        | parent_table | global_index_pt
 parent_table_2_list_1_hash_0_category_idx | parent_table_2_list_1_hash_0 | parent_table | global_index_pt
 parent_table_2_list_1_hash_1_category_idx | parent_table_2_list_1_hash_1 | parent_table | global_index_pt
 parent_table_2_list_1_hash_2_category_idx | parent_table_2_list_1_hash_2 | parent_table | global_index_pt
 parent_table_2_list_2_category_idx        | parent_table_2_list_2        | parent_table | global_index_pt
 parent_table_2_list_2_hash_0_category_idx | parent_table_2_list_2_hash_0 | parent_table | global_index_pt
 parent_table_2_list_2_hash_1_category_idx | parent_table_2_list_2_hash_1 | parent_table | global_index_pt
 parent_table_2_list_2_hash_2_category_idx | parent_table_2_list_2_hash_2 | parent_table | global_index_pt
(27 rows)

SELECT indexrelid::regclass, indrelid::regclass, indtoprelid::regclass, indtopindexid::regclass FROM pg_index WHERE indtopindexid::regclass ='global_index_pt_0'::regclass;
                  indexrelid                   |           indrelid           |  indtoprelid   |   indtopindexid   
-----------------------------------------------+------------------------------+----------------+-------------------
 parent_table_0_list_1_sub_category_idx        | parent_table_0_list_1        | parent_table_0 | global_index_pt_0
 parent_table_0_list_1_hash_0_sub_category_idx | parent_table_0_list_1_hash_0 | parent_table_0 | global_index_pt_0
 parent_table_0_list_1_hash_1_sub_category_idx | parent_table_0_list_1_hash_1 | parent_table_0 | global_index_pt_0
 parent_table_0_list_1_hash_2_sub_category_idx | parent_table_0_list_1_hash_2 | parent_table_0 | global_index_pt_0
 parent_table_0_list_2_sub_category_idx        | parent_table_0_list_2        | parent_table_0 | global_index_pt_0
 parent_table_0_list_2_hash_0_sub_category_idx | parent_table_0_list_2_hash_0 | parent_table_0 | global_index_pt_0
 parent_table_0_list_2_hash_1_sub_category_idx | parent_table_0_list_2_hash_1 | parent_table_0 | global_index_pt_0
 parent_table_0_list_2_hash_2_sub_category_idx | parent_table_0_list_2_hash_2 | parent_table_0 | global_index_pt_0
(8 rows)

SELECT indexrelid::regclass, indrelid::regclass, indtoprelid::regclass, indtopindexid::regclass FROM pg_index WHERE indtopindexid::regclass ='global_index_pt_l_2'::regclass;
               indexrelid               |           indrelid           |      indtoprelid      |    indtopindexid    
----------------------------------------+------------------------------+-----------------------+---------------------
 parent_table_2_list_2_hash_0_value_idx | parent_table_2_list_2_hash_0 | parent_table_2_list_2 | global_index_pt_l_2
 parent_table_2_list_2_hash_1_value_idx | parent_table_2_list_2_hash_1 | parent_table_2_list_2 | global_index_pt_l_2
 parent_table_2_list_2_hash_2_value_idx | parent_table_2_list_2_hash_2 | parent_table_2_list_2 | global_index_pt_l_2
(3 rows)

EXPLAIN (COSTS OFF) SELECT * FROM parent_table WHERE category='1';
                       QUERY PLAN                        
---------------------------------------------------------
 Global Index Scan using global_index_pt on parent_table
   Index Cond: (category = '1'::text)
(2 rows)

SELECT * FROM parent_table WHERE category='1';
  id  | category | sub_category | value 
------+----------+--------------+-------
    2 | 1        | 3            |     2
    4 | 1        | 5            |     4
    6 | 1        | 7            |     6
    8 | 1        | 9            |     8
   16 | 1        | 7            |    16
   18 | 1        | 9            |    18
   20 | 1        | 1            |    20
   34 | 1        | 5            |    34
   38 | 1        | 9            |    38
   42 | 1        | 3            |    42
   48 | 1        | 9            |    48
   50 | 1        | 1            |    50
   54 | 1        | 5            |    54
   60 | 1        | 1            |    60
   62 | 1        | 3            |    62
   72 | 1        | 3            |    72
   84 | 1        | 5            |    84
   86 | 1        | 7            |    86
   96 | 1        | 7            |    96
  104 | 1        | 5            |   104
  108 | 1        | 9            |   108
  112 | 1        | 3            |   112
  122 | 1        | 3            |   122
  132 | 1        | 3            |   132
  140 | 1        | 1            |   140
  142 | 1        | 3            |   142
  152 | 1        | 3            |   152
  158 | 1        | 9            |   158
  174 | 1        | 5            |   174
  176 | 1        | 7            |   176
  178 | 1        | 9            |   178
  182 | 1        | 3            |   182
  186 | 1        | 7            |   186
  200 | 1        | 1            |   200
  202 | 1        | 3            |   202
  206 | 1        | 7            |   206
  210 | 1        | 1            |   210
  214 | 1        | 5            |   214
  216 | 1        | 7            |   216
  218 | 1        | 9            |   218
  228 | 1        | 9            |   228
  230 | 1        | 1            |   230
  234 | 1        | 5            |   234
  236 | 1        | 7            |   236
  244 | 1        | 5            |   244
  248 | 1        | 9            |   248
  252 | 1        | 3            |   252
  256 | 1        | 7            |   256
  258 | 1        | 9            |   258
  262 | 1        | 3            |   262
  266 | 1        | 7            |   266
  276 | 1        | 7            |   276
  278 | 1        | 9            |   278
  280 | 1        | 1            |   280
  292 | 1        | 3            |   292
  294 | 1        | 5            |   294
  296 | 1        | 7            |   296
  298 | 1        | 9            |   298
  306 | 1        | 7            |   306
  310 | 1        | 1            |   310
  324 | 1        | 5            |   324
  326 | 1        | 7            |   326
  332 | 1        | 3            |   332
  334 | 1        | 5            |   334
  338 | 1        | 9            |   338
  340 | 1        | 1            |   340
  342 | 1        | 3            |   342
  346 | 1        | 7            |   346
  354 | 1        | 5            |   354
  378 | 1        | 9            |   378
  382 | 1        | 3            |   382
  384 | 1        | 5            |   384
  392 | 1        | 3            |   392
  400 | 1        | 1            |   400
  404 | 1        | 5            |   404
  406 | 1        | 7            |   406
  408 | 1        | 9            |   408
  410 | 1        | 1            |   410
  416 | 1        | 7            |   416
  438 | 1        | 9            |   438
  442 | 1        | 3            |   442
  444 | 1        | 5            |   444
  452 | 1        | 3            |   452
  458 | 1        | 9            |   458
  468 | 1        | 9            |   468
  472 | 1        | 3            |   472
  476 | 1        | 7            |   476
  478 | 1        | 9            |   478
  488 | 1        | 9            |   488
  500 | 1        | 1            |   500
  506 | 1        | 7            |   506
  518 | 1        | 9            |   518
  522 | 1        | 3            |   522
  524 | 1        | 5            |   524
  532 | 1        | 3            |   532
  534 | 1        | 5            |   534
  538 | 1        | 9            |   538
  546 | 1        | 7            |   546
  552 | 1        | 3            |   552
  554 | 1        | 5            |   554
  560 | 1        | 1            |   560
  566 | 1        | 7            |   566
  568 | 1        | 9            |   568
  572 | 1        | 3            |   572
  574 | 1        | 5            |   574
  578 | 1        | 9            |   578
  582 | 1        | 3            |   582
  596 | 1        | 7            |   596
  598 | 1        | 9            |   598
  604 | 1        | 5            |   604
  628 | 1        | 9            |   628
  644 | 1        | 5            |   644
  646 | 1        | 7            |   646
  652 | 1        | 3            |   652
  654 | 1        | 5            |   654
  656 | 1        | 7            |   656
  660 | 1        | 1            |   660
  664 | 1        | 5            |   664
  672 | 1        | 3            |   672
  678 | 1        | 9            |   678
  682 | 1        | 3            |   682
  694 | 1        | 5            |   694
  700 | 1        | 1            |   700
  706 | 1        | 7            |   706
  710 | 1        | 1            |   710
  720 | 1        | 1            |   720
  724 | 1        | 5            |   724
  728 | 1        | 9            |   728
  746 | 1        | 7            |   746
  756 | 1        | 7            |   756
  758 | 1        | 9            |   758
  762 | 1        | 3            |   762
  766 | 1        | 7            |   766
  776 | 1        | 7            |   776
  780 | 1        | 1            |   780
  790 | 1        | 1            |   790
  794 | 1        | 5            |   794
  796 | 1        | 7            |   796
  800 | 1        | 1            |   800
  802 | 1        | 3            |   802
  806 | 1        | 7            |   806
  822 | 1        | 3            |   822
  824 | 1        | 5            |   824
  828 | 1        | 9            |   828
  830 | 1        | 1            |   830
  836 | 1        | 7            |   836
  838 | 1        | 9            |   838
  840 | 1        | 1            |   840
  856 | 1        | 7            |   856
  858 | 1        | 9            |   858
  860 | 1        | 1            |   860
  862 | 1        | 3            |   862
  866 | 1        | 7            |   866
  868 | 1        | 9            |   868
  876 | 1        | 7            |   876
  882 | 1        | 3            |   882
  886 | 1        | 7            |   886
  890 | 1        | 1            |   890
  892 | 1        | 3            |   892
  894 | 1        | 5            |   894
  896 | 1        | 7            |   896
  904 | 1        | 5            |   904
  914 | 1        | 5            |   914
  920 | 1        | 1            |   920
  922 | 1        | 3            |   922
  942 | 1        | 3            |   942
  954 | 1        | 5            |   954
  964 | 1        | 5            |   964
  974 | 1        | 5            |   974
  978 | 1        | 9            |   978
  994 | 1        | 5            |   994
   10 | 1        | 1            |    10
   14 | 1        | 5            |    14
   26 | 1        | 7            |    26
   36 | 1        | 7            |    36
   40 | 1        | 1            |    40
   44 | 1        | 5            |    44
   46 | 1        | 7            |    46
   52 | 1        | 3            |    52
   58 | 1        | 9            |    58
   64 | 1        | 5            |    64
   76 | 1        | 7            |    76
   78 | 1        | 9            |    78
   82 | 1        | 3            |    82
   90 | 1        | 1            |    90
   94 | 1        | 5            |    94
  110 | 1        | 1            |   110
  114 | 1        | 5            |   114
  116 | 1        | 7            |   116
  118 | 1        | 9            |   118
  128 | 1        | 9            |   128
  134 | 1        | 5            |   134
  136 | 1        | 7            |   136
  146 | 1        | 7            |   146
  156 | 1        | 7            |   156
  162 | 1        | 3            |   162
  164 | 1        | 5            |   164
  166 | 1        | 7            |   166
  168 | 1        | 9            |   168
  180 | 1        | 1            |   180
  190 | 1        | 1            |   190
  192 | 1        | 3            |   192
  196 | 1        | 7            |   196
  204 | 1        | 5            |   204
  222 | 1        | 3            |   222
  224 | 1        | 5            |   224
  226 | 1        | 7            |   226
  246 | 1        | 7            |   246
  260 | 1        | 1            |   260
  264 | 1        | 5            |   264
  270 | 1        | 1            |   270
  272 | 1        | 3            |   272
  274 | 1        | 5            |   274
  284 | 1        | 5            |   284
  286 | 1        | 7            |   286
  290 | 1        | 1            |   290
  300 | 1        | 1            |   300
  302 | 1        | 3            |   302
  304 | 1        | 5            |   304
  308 | 1        | 9            |   308
  312 | 1        | 3            |   312
  314 | 1        | 5            |   314
  316 | 1        | 7            |   316
  320 | 1        | 1            |   320
  322 | 1        | 3            |   322
  328 | 1        | 9            |   328
  336 | 1        | 7            |   336
  350 | 1        | 1            |   350
  356 | 1        | 7            |   356
  358 | 1        | 9            |   358
  374 | 1        | 5            |   374
  376 | 1        | 7            |   376
  380 | 1        | 1            |   380
  386 | 1        | 7            |   386
  388 | 1        | 9            |   388
  402 | 1        | 3            |   402
  412 | 1        | 3            |   412
  418 | 1        | 9            |   418
  422 | 1        | 3            |   422
  426 | 1        | 7            |   426
  428 | 1        | 9            |   428
  430 | 1        | 1            |   430
  434 | 1        | 5            |   434
  436 | 1        | 7            |   436
  440 | 1        | 1            |   440
  446 | 1        | 7            |   446
  450 | 1        | 1            |   450
  456 | 1        | 7            |   456
  462 | 1        | 3            |   462
  480 | 1        | 1            |   480
  482 | 1        | 3            |   482
  484 | 1        | 5            |   484
  494 | 1        | 5            |   494
  498 | 1        | 9            |   498
  504 | 1        | 5            |   504
  512 | 1        | 3            |   512
  514 | 1        | 5            |   514
  516 | 1        | 7            |   516
  536 | 1        | 7            |   536
  550 | 1        | 1            |   550
  556 | 1        | 7            |   556
  562 | 1        | 3            |   562
  570 | 1        | 1            |   570
  576 | 1        | 7            |   576
  584 | 1        | 5            |   584
  586 | 1        | 7            |   586
  606 | 1        | 7            |   606
  610 | 1        | 1            |   610
  616 | 1        | 7            |   616
  618 | 1        | 9            |   618
  620 | 1        | 1            |   620
  622 | 1        | 3            |   622
  626 | 1        | 7            |   626
  630 | 1        | 1            |   630
  636 | 1        | 7            |   636
  638 | 1        | 9            |   638
  640 | 1        | 1            |   640
  642 | 1        | 3            |   642
  650 | 1        | 1            |   650
  662 | 1        | 3            |   662
  666 | 1        | 7            |   666
  680 | 1        | 1            |   680
  684 | 1        | 5            |   684
  688 | 1        | 9            |   688
  704 | 1        | 5            |   704
  712 | 1        | 3            |   712
  726 | 1        | 7            |   726
  730 | 1        | 1            |   730
  732 | 1        | 3            |   732
  734 | 1        | 5            |   734
  740 | 1        | 1            |   740
  742 | 1        | 3            |   742
  744 | 1        | 5            |   744
  748 | 1        | 9            |   748
  754 | 1        | 5            |   754
  764 | 1        | 5            |   764
  768 | 1        | 9            |   768
  774 | 1        | 5            |   774
  784 | 1        | 5            |   784
  786 | 1        | 7            |   786
  804 | 1        | 5            |   804
  808 | 1        | 9            |   808
  814 | 1        | 5            |   814
  816 | 1        | 7            |   816
  818 | 1        | 9            |   818
  820 | 1        | 1            |   820
  832 | 1        | 3            |   832
  842 | 1        | 3            |   842
  844 | 1        | 5            |   844
  846 | 1        | 7            |   846
  854 | 1        | 5            |   854
  872 | 1        | 3            |   872
  878 | 1        | 9            |   878
  884 | 1        | 5            |   884
  888 | 1        | 9            |   888
  900 | 1        | 1            |   900
  902 | 1        | 3            |   902
  906 | 1        | 7            |   906
  908 | 1        | 9            |   908
  910 | 1        | 1            |   910
  912 | 1        | 3            |   912
  916 | 1        | 7            |   916
  918 | 1        | 9            |   918
  924 | 1        | 5            |   924
  926 | 1        | 7            |   926
  928 | 1        | 9            |   928
  930 | 1        | 1            |   930
  932 | 1        | 3            |   932
  936 | 1        | 7            |   936
  938 | 1        | 9            |   938
  940 | 1        | 1            |   940
  944 | 1        | 5            |   944
  952 | 1        | 3            |   952
  956 | 1        | 7            |   956
  960 | 1        | 1            |   960
  962 | 1        | 3            |   962
  976 | 1        | 7            |   976
  982 | 1        | 3            |   982
  984 | 1        | 5            |   984
  986 | 1        | 7            |   986
   12 | 1        | 3            |    12
   22 | 1        | 3            |    22
   24 | 1        | 5            |    24
   28 | 1        | 9            |    28
   30 | 1        | 1            |    30
   32 | 1        | 3            |    32
   56 | 1        | 7            |    56
   66 | 1        | 7            |    66
   68 | 1        | 9            |    68
   70 | 1        | 1            |    70
   74 | 1        | 5            |    74
   80 | 1        | 1            |    80
   88 | 1        | 9            |    88
   92 | 1        | 3            |    92
   98 | 1        | 9            |    98
  100 | 1        | 1            |   100
  102 | 1        | 3            |   102
  106 | 1        | 7            |   106
  120 | 1        | 1            |   120
  124 | 1        | 5            |   124
  126 | 1        | 7            |   126
  130 | 1        | 1            |   130
  138 | 1        | 9            |   138
  144 | 1        | 5            |   144
  148 | 1        | 9            |   148
  150 | 1        | 1            |   150
  154 | 1        | 5            |   154
  160 | 1        | 1            |   160
  170 | 1        | 1            |   170
  172 | 1        | 3            |   172
  184 | 1        | 5            |   184
  188 | 1        | 9            |   188
  194 | 1        | 5            |   194
  198 | 1        | 9            |   198
  208 | 1        | 9            |   208
  212 | 1        | 3            |   212
  220 | 1        | 1            |   220
  232 | 1        | 3            |   232
  238 | 1        | 9            |   238
  240 | 1        | 1            |   240
  242 | 1        | 3            |   242
  250 | 1        | 1            |   250
  254 | 1        | 5            |   254
  268 | 1        | 9            |   268
  282 | 1        | 3            |   282
  288 | 1        | 9            |   288
  318 | 1        | 9            |   318
  330 | 1        | 1            |   330
  344 | 1        | 5            |   344
  348 | 1        | 9            |   348
  352 | 1        | 3            |   352
  360 | 1        | 1            |   360
  362 | 1        | 3            |   362
  364 | 1        | 5            |   364
  366 | 1        | 7            |   366
  368 | 1        | 9            |   368
  370 | 1        | 1            |   370
  372 | 1        | 3            |   372
  390 | 1        | 1            |   390
  394 | 1        | 5            |   394
  396 | 1        | 7            |   396
  398 | 1        | 9            |   398
  414 | 1        | 5            |   414
  420 | 1        | 1            |   420
  424 | 1        | 5            |   424
  432 | 1        | 3            |   432
  448 | 1        | 9            |   448
  454 | 1        | 5            |   454
  460 | 1        | 1            |   460
  464 | 1        | 5            |   464
  466 | 1        | 7            |   466
  470 | 1        | 1            |   470
  474 | 1        | 5            |   474
  486 | 1        | 7            |   486
  490 | 1        | 1            |   490
  492 | 1        | 3            |   492
  496 | 1        | 7            |   496
  502 | 1        | 3            |   502
  508 | 1        | 9            |   508
  510 | 1        | 1            |   510
  520 | 1        | 1            |   520
  526 | 1        | 7            |   526
  528 | 1        | 9            |   528
  530 | 1        | 1            |   530
  540 | 1        | 1            |   540
  542 | 1        | 3            |   542
  544 | 1        | 5            |   544
  548 | 1        | 9            |   548
  558 | 1        | 9            |   558
  564 | 1        | 5            |   564
  580 | 1        | 1            |   580
  588 | 1        | 9            |   588
  590 | 1        | 1            |   590
  592 | 1        | 3            |   592
  594 | 1        | 5            |   594
  600 | 1        | 1            |   600
  602 | 1        | 3            |   602
  608 | 1        | 9            |   608
  612 | 1        | 3            |   612
  614 | 1        | 5            |   614
  624 | 1        | 5            |   624
  632 | 1        | 3            |   632
  634 | 1        | 5            |   634
  648 | 1        | 9            |   648
  658 | 1        | 9            |   658
  668 | 1        | 9            |   668
  670 | 1        | 1            |   670
  674 | 1        | 5            |   674
  676 | 1        | 7            |   676
  686 | 1        | 7            |   686
  690 | 1        | 1            |   690
  692 | 1        | 3            |   692
  696 | 1        | 7            |   696
  698 | 1        | 9            |   698
  702 | 1        | 3            |   702
  708 | 1        | 9            |   708
  714 | 1        | 5            |   714
  716 | 1        | 7            |   716
  718 | 1        | 9            |   718
  722 | 1        | 3            |   722
  736 | 1        | 7            |   736
  738 | 1        | 9            |   738
  750 | 1        | 1            |   750
  752 | 1        | 3            |   752
  760 | 1        | 1            |   760
  770 | 1        | 1            |   770
  772 | 1        | 3            |   772
  778 | 1        | 9            |   778
  782 | 1        | 3            |   782
  788 | 1        | 9            |   788
  792 | 1        | 3            |   792
  798 | 1        | 9            |   798
  810 | 1        | 1            |   810
  812 | 1        | 3            |   812
  826 | 1        | 7            |   826
  834 | 1        | 5            |   834
  848 | 1        | 9            |   848
  850 | 1        | 1            |   850
  852 | 1        | 3            |   852
  864 | 1        | 5            |   864
  870 | 1        | 1            |   870
  874 | 1        | 5            |   874
  880 | 1        | 1            |   880
  898 | 1        | 9            |   898
  934 | 1        | 5            |   934
  946 | 1        | 7            |   946
  948 | 1        | 9            |   948
  950 | 1        | 1            |   950
  958 | 1        | 9            |   958
  966 | 1        | 7            |   966
  968 | 1        | 9            |   968
  970 | 1        | 1            |   970
  972 | 1        | 3            |   972
  980 | 1        | 1            |   980
  988 | 1        | 9            |   988
  990 | 1        | 1            |   990
  992 | 1        | 3            |   992
  996 | 1        | 7            |   996
  998 | 1        | 9            |   998
 1008 | 1        | 9            |  1008
 1014 | 1        | 5            |  1014
 1018 | 1        | 9            |  1018
 1022 | 1        | 3            |  1022
 1024 | 1        | 5            |  1024
 1028 | 1        | 9            |  1028
 1034 | 1        | 5            |  1034
 1040 | 1        | 1            |  1040
 1042 | 1        | 3            |  1042
 1048 | 1        | 9            |  1048
 1060 | 1        | 1            |  1060
 1064 | 1        | 5            |  1064
 1070 | 1        | 1            |  1070
 1078 | 1        | 9            |  1078
 1080 | 1        | 1            |  1080
 1082 | 1        | 3            |  1082
 1086 | 1        | 7            |  1086
 1096 | 1        | 7            |  1096
 1100 | 1        | 1            |  1100
 1104 | 1        | 5            |  1104
 1114 | 1        | 5            |  1114
 1118 | 1        | 9            |  1118
 1120 | 1        | 1            |  1120
 1126 | 1        | 7            |  1126
 1130 | 1        | 1            |  1130
 1134 | 1        | 5            |  1134
 1138 | 1        | 9            |  1138
 1140 | 1        | 1            |  1140
 1142 | 1        | 3            |  1142
 1146 | 1        | 7            |  1146
 1148 | 1        | 9            |  1148
 1156 | 1        | 7            |  1156
 1158 | 1        | 9            |  1158
 1160 | 1        | 1            |  1160
 1162 | 1        | 3            |  1162
 1164 | 1        | 5            |  1164
 1176 | 1        | 7            |  1176
 1186 | 1        | 7            |  1186
 1190 | 1        | 1            |  1190
 1196 | 1        | 7            |  1196
 1206 | 1        | 7            |  1206
 1208 | 1        | 9            |  1208
 1212 | 1        | 3            |  1212
 1214 | 1        | 5            |  1214
 1230 | 1        | 1            |  1230
 1234 | 1        | 5            |  1234
 1240 | 1        | 1            |  1240
 1242 | 1        | 3            |  1242
 1256 | 1        | 7            |  1256
 1274 | 1        | 5            |  1274
 1276 | 1        | 7            |  1276
 1278 | 1        | 9            |  1278
 1280 | 1        | 1            |  1280
 1286 | 1        | 7            |  1286
 1288 | 1        | 9            |  1288
 1294 | 1        | 5            |  1294
 1296 | 1        | 7            |  1296
 1298 | 1        | 9            |  1298
 1302 | 1        | 3            |  1302
 1310 | 1        | 1            |  1310
 1318 | 1        | 9            |  1318
 1326 | 1        | 7            |  1326
 1336 | 1        | 7            |  1336
 1342 | 1        | 3            |  1342
 1344 | 1        | 5            |  1344
 1346 | 1        | 7            |  1346
 1360 | 1        | 1            |  1360
 1362 | 1        | 3            |  1362
 1366 | 1        | 7            |  1366
 1382 | 1        | 3            |  1382
 1384 | 1        | 5            |  1384
 1392 | 1        | 3            |  1392
 1394 | 1        | 5            |  1394
 1396 | 1        | 7            |  1396
 1400 | 1        | 1            |  1400
 1420 | 1        | 1            |  1420
 1426 | 1        | 7            |  1426
 1428 | 1        | 9            |  1428
 1436 | 1        | 7            |  1436
 1438 | 1        | 9            |  1438
 1440 | 1        | 1            |  1440
 1462 | 1        | 3            |  1462
 1466 | 1        | 7            |  1466
 1468 | 1        | 9            |  1468
 1474 | 1        | 5            |  1474
 1476 | 1        | 7            |  1476
 1478 | 1        | 9            |  1478
 1482 | 1        | 3            |  1482
 1502 | 1        | 3            |  1502
 1504 | 1        | 5            |  1504
 1512 | 1        | 3            |  1512
 1516 | 1        | 7            |  1516
 1518 | 1        | 9            |  1518
 1520 | 1        | 1            |  1520
 1522 | 1        | 3            |  1522
 1528 | 1        | 9            |  1528
 1532 | 1        | 3            |  1532
 1544 | 1        | 5            |  1544
 1548 | 1        | 9            |  1548
 1550 | 1        | 1            |  1550
 1552 | 1        | 3            |  1552
 1566 | 1        | 7            |  1566
 1570 | 1        | 1            |  1570
 1574 | 1        | 5            |  1574
 1576 | 1        | 7            |  1576
 1582 | 1        | 3            |  1582
 1584 | 1        | 5            |  1584
 1592 | 1        | 3            |  1592
 1598 | 1        | 9            |  1598
 1602 | 1        | 3            |  1602
 1608 | 1        | 9            |  1608
 1610 | 1        | 1            |  1610
 1616 | 1        | 7            |  1616
 1620 | 1        | 1            |  1620
 1622 | 1        | 3            |  1622
 1624 | 1        | 5            |  1624
 1634 | 1        | 5            |  1634
 1636 | 1        | 7            |  1636
 1642 | 1        | 3            |  1642
 1644 | 1        | 5            |  1644
 1646 | 1        | 7            |  1646
 1652 | 1        | 3            |  1652
 1654 | 1        | 5            |  1654
 1662 | 1        | 3            |  1662
 1664 | 1        | 5            |  1664
 1666 | 1        | 7            |  1666
 1668 | 1        | 9            |  1668
 1676 | 1        | 7            |  1676
 1678 | 1        | 9            |  1678
 1682 | 1        | 3            |  1682
 1692 | 1        | 3            |  1692
 1694 | 1        | 5            |  1694
 1698 | 1        | 9            |  1698
 1702 | 1        | 3            |  1702
 1704 | 1        | 5            |  1704
 1716 | 1        | 7            |  1716
 1720 | 1        | 1            |  1720
 1728 | 1        | 9            |  1728
 1730 | 1        | 1            |  1730
 1744 | 1        | 5            |  1744
 1746 | 1        | 7            |  1746
 1748 | 1        | 9            |  1748
 1752 | 1        | 3            |  1752
 1758 | 1        | 9            |  1758
 1766 | 1        | 7            |  1766
 1770 | 1        | 1            |  1770
 1778 | 1        | 9            |  1778
 1780 | 1        | 1            |  1780
 1782 | 1        | 3            |  1782
 1786 | 1        | 7            |  1786
 1788 | 1        | 9            |  1788
 1794 | 1        | 5            |  1794
 1798 | 1        | 9            |  1798
 1800 | 1        | 1            |  1800
 1808 | 1        | 9            |  1808
 1810 | 1        | 1            |  1810
 1824 | 1        | 5            |  1824
 1832 | 1        | 3            |  1832
 1834 | 1        | 5            |  1834
 1836 | 1        | 7            |  1836
 1838 | 1        | 9            |  1838
 1846 | 1        | 7            |  1846
 1864 | 1        | 5            |  1864
 1868 | 1        | 9            |  1868
 1874 | 1        | 5            |  1874
 1882 | 1        | 3            |  1882
 1884 | 1        | 5            |  1884
 1888 | 1        | 9            |  1888
 1890 | 1        | 1            |  1890
 1912 | 1        | 3            |  1912
 1916 | 1        | 7            |  1916
 1920 | 1        | 1            |  1920
 1924 | 1        | 5            |  1924
 1928 | 1        | 9            |  1928
 1940 | 1        | 1            |  1940
 1944 | 1        | 5            |  1944
 1948 | 1        | 9            |  1948
 1950 | 1        | 1            |  1950
 1972 | 1        | 3            |  1972
 1988 | 1        | 9            |  1988
 1992 | 1        | 3            |  1992
 1002 | 1        | 3            |  1002
 1004 | 1        | 5            |  1004
 1006 | 1        | 7            |  1006
 1012 | 1        | 3            |  1012
 1026 | 1        | 7            |  1026
 1030 | 1        | 1            |  1030
 1038 | 1        | 9            |  1038
 1044 | 1        | 5            |  1044
 1046 | 1        | 7            |  1046
 1052 | 1        | 3            |  1052
 1054 | 1        | 5            |  1054
 1058 | 1        | 9            |  1058
 1068 | 1        | 9            |  1068
 1072 | 1        | 3            |  1072
 1092 | 1        | 3            |  1092
 1098 | 1        | 9            |  1098
 1116 | 1        | 7            |  1116
 1122 | 1        | 3            |  1122
 1128 | 1        | 9            |  1128
 1132 | 1        | 3            |  1132
 1144 | 1        | 5            |  1144
 1150 | 1        | 1            |  1150
 1154 | 1        | 5            |  1154
 1168 | 1        | 9            |  1168
 1174 | 1        | 5            |  1174
 1180 | 1        | 1            |  1180
 1192 | 1        | 3            |  1192
 1194 | 1        | 5            |  1194
 1200 | 1        | 1            |  1200
 1216 | 1        | 7            |  1216
 1220 | 1        | 1            |  1220
 1226 | 1        | 7            |  1226
 1236 | 1        | 7            |  1236
 1238 | 1        | 9            |  1238
 1244 | 1        | 5            |  1244
 1248 | 1        | 9            |  1248
 1250 | 1        | 1            |  1250
 1252 | 1        | 3            |  1252
 1260 | 1        | 1            |  1260
 1262 | 1        | 3            |  1262
 1266 | 1        | 7            |  1266
 1270 | 1        | 1            |  1270
 1284 | 1        | 5            |  1284
 1300 | 1        | 1            |  1300
 1306 | 1        | 7            |  1306
 1308 | 1        | 9            |  1308
 1312 | 1        | 3            |  1312
 1316 | 1        | 7            |  1316
 1320 | 1        | 1            |  1320
 1322 | 1        | 3            |  1322
 1332 | 1        | 3            |  1332
 1340 | 1        | 1            |  1340
 1348 | 1        | 9            |  1348
 1354 | 1        | 5            |  1354
 1358 | 1        | 9            |  1358
 1368 | 1        | 9            |  1368
 1374 | 1        | 5            |  1374
 1376 | 1        | 7            |  1376
 1378 | 1        | 9            |  1378
 1388 | 1        | 9            |  1388
 1390 | 1        | 1            |  1390
 1398 | 1        | 9            |  1398
 1404 | 1        | 5            |  1404
 1406 | 1        | 7            |  1406
 1408 | 1        | 9            |  1408
 1412 | 1        | 3            |  1412
 1416 | 1        | 7            |  1416
 1418 | 1        | 9            |  1418
 1422 | 1        | 3            |  1422
 1424 | 1        | 5            |  1424
 1430 | 1        | 1            |  1430
 1434 | 1        | 5            |  1434
 1442 | 1        | 3            |  1442
 1446 | 1        | 7            |  1446
 1452 | 1        | 3            |  1452
 1454 | 1        | 5            |  1454
 1458 | 1        | 9            |  1458
 1470 | 1        | 1            |  1470
 1472 | 1        | 3            |  1472
 1480 | 1        | 1            |  1480
 1486 | 1        | 7            |  1486
 1488 | 1        | 9            |  1488
 1492 | 1        | 3            |  1492
 1506 | 1        | 7            |  1506
 1526 | 1        | 7            |  1526
 1530 | 1        | 1            |  1530
 1534 | 1        | 5            |  1534
 1538 | 1        | 9            |  1538
 1556 | 1        | 7            |  1556
 1560 | 1        | 1            |  1560
 1562 | 1        | 3            |  1562
 1564 | 1        | 5            |  1564
 1568 | 1        | 9            |  1568
 1580 | 1        | 1            |  1580
 1586 | 1        | 7            |  1586
 1588 | 1        | 9            |  1588
 1594 | 1        | 5            |  1594
 1596 | 1        | 7            |  1596
 1600 | 1        | 1            |  1600
 1604 | 1        | 5            |  1604
 1626 | 1        | 7            |  1626
 1630 | 1        | 1            |  1630
 1638 | 1        | 9            |  1638
 1640 | 1        | 1            |  1640
 1656 | 1        | 7            |  1656
 1672 | 1        | 3            |  1672
 1680 | 1        | 1            |  1680
 1684 | 1        | 5            |  1684
 1708 | 1        | 9            |  1708
 1722 | 1        | 3            |  1722
 1724 | 1        | 5            |  1724
 1726 | 1        | 7            |  1726
 1732 | 1        | 3            |  1732
 1736 | 1        | 7            |  1736
 1740 | 1        | 1            |  1740
 1750 | 1        | 1            |  1750
 1754 | 1        | 5            |  1754
 1760 | 1        | 1            |  1760
 1762 | 1        | 3            |  1762
 1764 | 1        | 5            |  1764
 1790 | 1        | 1            |  1790
 1806 | 1        | 7            |  1806
 1812 | 1        | 3            |  1812
 1814 | 1        | 5            |  1814
 1818 | 1        | 9            |  1818
 1820 | 1        | 1            |  1820
 1828 | 1        | 9            |  1828
 1830 | 1        | 1            |  1830
 1840 | 1        | 1            |  1840
 1844 | 1        | 5            |  1844
 1848 | 1        | 9            |  1848
 1850 | 1        | 1            |  1850
 1856 | 1        | 7            |  1856
 1870 | 1        | 1            |  1870
 1872 | 1        | 3            |  1872
 1876 | 1        | 7            |  1876
 1880 | 1        | 1            |  1880
 1892 | 1        | 3            |  1892
 1898 | 1        | 9            |  1898
 1902 | 1        | 3            |  1902
 1908 | 1        | 9            |  1908
 1910 | 1        | 1            |  1910
 1918 | 1        | 9            |  1918
 1926 | 1        | 7            |  1926
 1932 | 1        | 3            |  1932
 1934 | 1        | 5            |  1934
 1938 | 1        | 9            |  1938
 1942 | 1        | 3            |  1942
 1946 | 1        | 7            |  1946
 1952 | 1        | 3            |  1952
 1954 | 1        | 5            |  1954
 1956 | 1        | 7            |  1956
 1960 | 1        | 1            |  1960
 1968 | 1        | 9            |  1968
 1982 | 1        | 3            |  1982
 1990 | 1        | 1            |  1990
 1994 | 1        | 5            |  1994
 1996 | 1        | 7            |  1996
 1000 | 1        | 1            |  1000
 1010 | 1        | 1            |  1010
 1016 | 1        | 7            |  1016
 1020 | 1        | 1            |  1020
 1032 | 1        | 3            |  1032
 1036 | 1        | 7            |  1036
 1050 | 1        | 1            |  1050
 1056 | 1        | 7            |  1056
 1062 | 1        | 3            |  1062
 1066 | 1        | 7            |  1066
 1074 | 1        | 5            |  1074
 1076 | 1        | 7            |  1076
 1084 | 1        | 5            |  1084
 1088 | 1        | 9            |  1088
 1090 | 1        | 1            |  1090
 1094 | 1        | 5            |  1094
 1102 | 1        | 3            |  1102
 1106 | 1        | 7            |  1106
 1108 | 1        | 9            |  1108
 1110 | 1        | 1            |  1110
 1112 | 1        | 3            |  1112
 1124 | 1        | 5            |  1124
 1136 | 1        | 7            |  1136
 1152 | 1        | 3            |  1152
 1166 | 1        | 7            |  1166
 1170 | 1        | 1            |  1170
 1172 | 1        | 3            |  1172
 1178 | 1        | 9            |  1178
 1182 | 1        | 3            |  1182
 1184 | 1        | 5            |  1184
 1188 | 1        | 9            |  1188
 1198 | 1        | 9            |  1198
 1202 | 1        | 3            |  1202
 1204 | 1        | 5            |  1204
 1210 | 1        | 1            |  1210
 1218 | 1        | 9            |  1218
 1222 | 1        | 3            |  1222
 1224 | 1        | 5            |  1224
 1228 | 1        | 9            |  1228
 1232 | 1        | 3            |  1232
 1246 | 1        | 7            |  1246
 1254 | 1        | 5            |  1254
 1258 | 1        | 9            |  1258
 1264 | 1        | 5            |  1264
 1268 | 1        | 9            |  1268
 1272 | 1        | 3            |  1272
 1282 | 1        | 3            |  1282
 1290 | 1        | 1            |  1290
 1292 | 1        | 3            |  1292
 1304 | 1        | 5            |  1304
 1314 | 1        | 5            |  1314
 1324 | 1        | 5            |  1324
 1328 | 1        | 9            |  1328
 1330 | 1        | 1            |  1330
 1334 | 1        | 5            |  1334
 1338 | 1        | 9            |  1338
 1350 | 1        | 1            |  1350
 1352 | 1        | 3            |  1352
 1356 | 1        | 7            |  1356
 1364 | 1        | 5            |  1364
 1370 | 1        | 1            |  1370
 1372 | 1        | 3            |  1372
 1380 | 1        | 1            |  1380
 1386 | 1        | 7            |  1386
 1402 | 1        | 3            |  1402
 1410 | 1        | 1            |  1410
 1414 | 1        | 5            |  1414
 1432 | 1        | 3            |  1432
 1444 | 1        | 5            |  1444
 1448 | 1        | 9            |  1448
 1450 | 1        | 1            |  1450
 1456 | 1        | 7            |  1456
 1460 | 1        | 1            |  1460
 1464 | 1        | 5            |  1464
 1484 | 1        | 5            |  1484
 1490 | 1        | 1            |  1490
 1494 | 1        | 5            |  1494
 1496 | 1        | 7            |  1496
 1498 | 1        | 9            |  1498
 1500 | 1        | 1            |  1500
 1508 | 1        | 9            |  1508
 1510 | 1        | 1            |  1510
 1514 | 1        | 5            |  1514
 1524 | 1        | 5            |  1524
 1536 | 1        | 7            |  1536
 1540 | 1        | 1            |  1540
 1542 | 1        | 3            |  1542
 1546 | 1        | 7            |  1546
 1554 | 1        | 5            |  1554
 1558 | 1        | 9            |  1558
 1572 | 1        | 3            |  1572
 1578 | 1        | 9            |  1578
 1590 | 1        | 1            |  1590
 1606 | 1        | 7            |  1606
 1612 | 1        | 3            |  1612
 1614 | 1        | 5            |  1614
 1618 | 1        | 9            |  1618
 1628 | 1        | 9            |  1628
 1632 | 1        | 3            |  1632
 1648 | 1        | 9            |  1648
 1650 | 1        | 1            |  1650
 1658 | 1        | 9            |  1658
 1660 | 1        | 1            |  1660
 1670 | 1        | 1            |  1670
 1674 | 1        | 5            |  1674
 1686 | 1        | 7            |  1686
 1688 | 1        | 9            |  1688
 1690 | 1        | 1            |  1690
 1696 | 1        | 7            |  1696
 1700 | 1        | 1            |  1700
 1706 | 1        | 7            |  1706
 1710 | 1        | 1            |  1710
 1712 | 1        | 3            |  1712
 1714 | 1        | 5            |  1714
 1718 | 1        | 9            |  1718
 1734 | 1        | 5            |  1734
 1738 | 1        | 9            |  1738
 1742 | 1        | 3            |  1742
 1756 | 1        | 7            |  1756
 1768 | 1        | 9            |  1768
 1772 | 1        | 3            |  1772
 1774 | 1        | 5            |  1774
 1776 | 1        | 7            |  1776
 1784 | 1        | 5            |  1784
 1792 | 1        | 3            |  1792
 1796 | 1        | 7            |  1796
 1802 | 1        | 3            |  1802
 1804 | 1        | 5            |  1804
 1816 | 1        | 7            |  1816
 1822 | 1        | 3            |  1822
 1826 | 1        | 7            |  1826
 1842 | 1        | 3            |  1842
 1852 | 1        | 3            |  1852
 1854 | 1        | 5            |  1854
 1858 | 1        | 9            |  1858
 1860 | 1        | 1            |  1860
 1862 | 1        | 3            |  1862
 1866 | 1        | 7            |  1866
 1878 | 1        | 9            |  1878
 1886 | 1        | 7            |  1886
 1894 | 1        | 5            |  1894
 1896 | 1        | 7            |  1896
 1900 | 1        | 1            |  1900
 1904 | 1        | 5            |  1904
 1906 | 1        | 7            |  1906
 1914 | 1        | 5            |  1914
 1922 | 1        | 3            |  1922
 1930 | 1        | 1            |  1930
 1936 | 1        | 7            |  1936
 1958 | 1        | 9            |  1958
 1962 | 1        | 3            |  1962
 1964 | 1        | 5            |  1964
 1966 | 1        | 7            |  1966
 1970 | 1        | 1            |  1970
 1974 | 1        | 5            |  1974
 1976 | 1        | 7            |  1976
 1978 | 1        | 9            |  1978
 1980 | 1        | 1            |  1980
 1984 | 1        | 5            |  1984
 1986 | 1        | 7            |  1986
 1998 | 1        | 9            |  1998
 2004 | 1        | 5            |  2004
 2022 | 1        | 3            |  2022
 2036 | 1        | 7            |  2036
 2044 | 1        | 5            |  2044
 2046 | 1        | 7            |  2046
 2048 | 1        | 9            |  2048
 2050 | 1        | 1            |  2050
 2070 | 1        | 1            |  2070
 2076 | 1        | 7            |  2076
 2078 | 1        | 9            |  2078
 2086 | 1        | 7            |  2086
 2092 | 1        | 3            |  2092
 2096 | 1        | 7            |  2096
 2098 | 1        | 9            |  2098
 2100 | 1        | 1            |  2100
 2114 | 1        | 5            |  2114
 2122 | 1        | 3            |  2122
 2130 | 1        | 1            |  2130
 2140 | 1        | 1            |  2140
 2144 | 1        | 5            |  2144
 2146 | 1        | 7            |  2146
 2158 | 1        | 9            |  2158
 2162 | 1        | 3            |  2162
 2166 | 1        | 7            |  2166
 2180 | 1        | 1            |  2180
 2184 | 1        | 5            |  2184
 2188 | 1        | 9            |  2188
 2194 | 1        | 5            |  2194
 2200 | 1        | 1            |  2200
 2206 | 1        | 7            |  2206
 2210 | 1        | 1            |  2210
 2218 | 1        | 9            |  2218
 2220 | 1        | 1            |  2220
 2226 | 1        | 7            |  2226
 2228 | 1        | 9            |  2228
 2240 | 1        | 1            |  2240
 2248 | 1        | 9            |  2248
 2254 | 1        | 5            |  2254
 2264 | 1        | 5            |  2264
 2280 | 1        | 1            |  2280
 2284 | 1        | 5            |  2284
 2296 | 1        | 7            |  2296
 2298 | 1        | 9            |  2298
 2304 | 1        | 5            |  2304
 2310 | 1        | 1            |  2310
 2316 | 1        | 7            |  2316
 2318 | 1        | 9            |  2318
 2324 | 1        | 5            |  2324
 2328 | 1        | 9            |  2328
 2336 | 1        | 7            |  2336
 2342 | 1        | 3            |  2342
 2346 | 1        | 7            |  2346
 2350 | 1        | 1            |  2350
 2352 | 1        | 3            |  2352
 2356 | 1        | 7            |  2356
 2364 | 1        | 5            |  2364
 2372 | 1        | 3            |  2372
 2374 | 1        | 5            |  2374
 2378 | 1        | 9            |  2378
 2388 | 1        | 9            |  2388
 2390 | 1        | 1            |  2390
 2404 | 1        | 5            |  2404
 2408 | 1        | 9            |  2408
 2410 | 1        | 1            |  2410
 2414 | 1        | 5            |  2414
 2422 | 1        | 3            |  2422
 2428 | 1        | 9            |  2428
 2430 | 1        | 1            |  2430
 2438 | 1        | 9            |  2438
 2444 | 1        | 5            |  2444
 2452 | 1        | 3            |  2452
 2458 | 1        | 9            |  2458
 2466 | 1        | 7            |  2466
 2478 | 1        | 9            |  2478
 2488 | 1        | 9            |  2488
 2498 | 1        | 9            |  2498
 2500 | 1        | 1            |  2500
 2504 | 1        | 5            |  2504
 2514 | 1        | 5            |  2514
 2520 | 1        | 1            |  2520
 2530 | 1        | 1            |  2530
 2540 | 1        | 1            |  2540
 2546 | 1        | 7            |  2546
 2554 | 1        | 5            |  2554
 2564 | 1        | 5            |  2564
 2566 | 1        | 7            |  2566
 2568 | 1        | 9            |  2568
 2570 | 1        | 1            |  2570
 2580 | 1        | 1            |  2580
 2588 | 1        | 9            |  2588
 2590 | 1        | 1            |  2590
 2602 | 1        | 3            |  2602
 2612 | 1        | 3            |  2612
 2614 | 1        | 5            |  2614
 2620 | 1        | 1            |  2620
 2622 | 1        | 3            |  2622
 2632 | 1        | 3            |  2632
 2638 | 1        | 9            |  2638
 2642 | 1        | 3            |  2642
 2644 | 1        | 5            |  2644
 2654 | 1        | 5            |  2654
 2656 | 1        | 7            |  2656
 2660 | 1        | 1            |  2660
 2662 | 1        | 3            |  2662
 2670 | 1        | 1            |  2670
 2672 | 1        | 3            |  2672
 2678 | 1        | 9            |  2678
 2686 | 1        | 7            |  2686
 2688 | 1        | 9            |  2688
 2690 | 1        | 1            |  2690
 2696 | 1        | 7            |  2696
 2702 | 1        | 3            |  2702
 2706 | 1        | 7            |  2706
 2714 | 1        | 5            |  2714
 2716 | 1        | 7            |  2716
 2724 | 1        | 5            |  2724
 2728 | 1        | 9            |  2728
 2738 | 1        | 9            |  2738
 2740 | 1        | 1            |  2740
 2744 | 1        | 5            |  2744
 2746 | 1        | 7            |  2746
 2754 | 1        | 5            |  2754
 2756 | 1        | 7            |  2756
 2758 | 1        | 9            |  2758
 2762 | 1        | 3            |  2762
 2764 | 1        | 5            |  2764
 2766 | 1        | 7            |  2766
 2776 | 1        | 7            |  2776
 2780 | 1        | 1            |  2780
 2784 | 1        | 5            |  2784
 2790 | 1        | 1            |  2790
 2794 | 1        | 5            |  2794
 2796 | 1        | 7            |  2796
 2798 | 1        | 9            |  2798
 2802 | 1        | 3            |  2802
 2806 | 1        | 7            |  2806
 2822 | 1        | 3            |  2822
 2828 | 1        | 9            |  2828
 2836 | 1        | 7            |  2836
 2844 | 1        | 5            |  2844
 2846 | 1        | 7            |  2846
 2852 | 1        | 3            |  2852
 2854 | 1        | 5            |  2854
 2856 | 1        | 7            |  2856
 2864 | 1        | 5            |  2864
 2870 | 1        | 1            |  2870
 2882 | 1        | 3            |  2882
 2886 | 1        | 7            |  2886
 2900 | 1        | 1            |  2900
 2904 | 1        | 5            |  2904
 2906 | 1        | 7            |  2906
 2916 | 1        | 7            |  2916
 2918 | 1        | 9            |  2918
 2920 | 1        | 1            |  2920
 2934 | 1        | 5            |  2934
 2936 | 1        | 7            |  2936
 2938 | 1        | 9            |  2938
 2944 | 1        | 5            |  2944
 2948 | 1        | 9            |  2948
 2950 | 1        | 1            |  2950
 2952 | 1        | 3            |  2952
 2956 | 1        | 7            |  2956
 2958 | 1        | 9            |  2958
 2962 | 1        | 3            |  2962
 2972 | 1        | 3            |  2972
 2978 | 1        | 9            |  2978
 2982 | 1        | 3            |  2982
 2994 | 1        | 5            |  2994
 2996 | 1        | 7            |  2996
 2016 | 1        | 7            |  2016
 2018 | 1        | 9            |  2018
 2026 | 1        | 7            |  2026
 2028 | 1        | 9            |  2028
 2032 | 1        | 3            |  2032
 2034 | 1        | 5            |  2034
 2040 | 1        | 1            |  2040
 2052 | 1        | 3            |  2052
 2054 | 1        | 5            |  2054
 2056 | 1        | 7            |  2056
 2058 | 1        | 9            |  2058
 2060 | 1        | 1            |  2060
 2062 | 1        | 3            |  2062
 2064 | 1        | 5            |  2064
 2066 | 1        | 7            |  2066
 2068 | 1        | 9            |  2068
 2072 | 1        | 3            |  2072
 2088 | 1        | 9            |  2088
 2102 | 1        | 3            |  2102
 2104 | 1        | 5            |  2104
 2116 | 1        | 7            |  2116
 2118 | 1        | 9            |  2118
 2120 | 1        | 1            |  2120
 2124 | 1        | 5            |  2124
 2128 | 1        | 9            |  2128
 2132 | 1        | 3            |  2132
 2136 | 1        | 7            |  2136
 2138 | 1        | 9            |  2138
 2148 | 1        | 9            |  2148
 2154 | 1        | 5            |  2154
 2156 | 1        | 7            |  2156
 2160 | 1        | 1            |  2160
 2164 | 1        | 5            |  2164
 2170 | 1        | 1            |  2170
 2174 | 1        | 5            |  2174
 2176 | 1        | 7            |  2176
 2182 | 1        | 3            |  2182
 2190 | 1        | 1            |  2190
 2198 | 1        | 9            |  2198
 2202 | 1        | 3            |  2202
 2204 | 1        | 5            |  2204
 2208 | 1        | 9            |  2208
 2212 | 1        | 3            |  2212
 2216 | 1        | 7            |  2216
 2222 | 1        | 3            |  2222
 2236 | 1        | 7            |  2236
 2242 | 1        | 3            |  2242
 2246 | 1        | 7            |  2246
 2250 | 1        | 1            |  2250
 2260 | 1        | 1            |  2260
 2262 | 1        | 3            |  2262
 2278 | 1        | 9            |  2278
 2294 | 1        | 5            |  2294
 2302 | 1        | 3            |  2302
 2308 | 1        | 9            |  2308
 2322 | 1        | 3            |  2322
 2334 | 1        | 5            |  2334
 2338 | 1        | 9            |  2338
 2340 | 1        | 1            |  2340
 2368 | 1        | 9            |  2368
 2370 | 1        | 1            |  2370
 2382 | 1        | 3            |  2382
 2384 | 1        | 5            |  2384
 2394 | 1        | 5            |  2394
 2398 | 1        | 9            |  2398
 2412 | 1        | 3            |  2412
 2418 | 1        | 9            |  2418
 2424 | 1        | 5            |  2424
 2426 | 1        | 7            |  2426
 2432 | 1        | 3            |  2432
 2434 | 1        | 5            |  2434
 2436 | 1        | 7            |  2436
 2442 | 1        | 3            |  2442
 2446 | 1        | 7            |  2446
 2448 | 1        | 9            |  2448
 2450 | 1        | 1            |  2450
 2456 | 1        | 7            |  2456
 2462 | 1        | 3            |  2462
 2464 | 1        | 5            |  2464
 2468 | 1        | 9            |  2468
 2470 | 1        | 1            |  2470
 2480 | 1        | 1            |  2480
 2486 | 1        | 7            |  2486
 2492 | 1        | 3            |  2492
 2494 | 1        | 5            |  2494
 2502 | 1        | 3            |  2502
 2506 | 1        | 7            |  2506
 2508 | 1        | 9            |  2508
 2516 | 1        | 7            |  2516
 2518 | 1        | 9            |  2518
 2522 | 1        | 3            |  2522
 2524 | 1        | 5            |  2524
 2534 | 1        | 5            |  2534
 2536 | 1        | 7            |  2536
 2542 | 1        | 3            |  2542
 2550 | 1        | 1            |  2550
 2552 | 1        | 3            |  2552
 2558 | 1        | 9            |  2558
 2572 | 1        | 3            |  2572
 2576 | 1        | 7            |  2576
 2582 | 1        | 3            |  2582
 2584 | 1        | 5            |  2584
 2586 | 1        | 7            |  2586
 2598 | 1        | 9            |  2598
 2606 | 1        | 7            |  2606
 2608 | 1        | 9            |  2608
 2630 | 1        | 1            |  2630
 2634 | 1        | 5            |  2634
 2636 | 1        | 7            |  2636
 2646 | 1        | 7            |  2646
 2648 | 1        | 9            |  2648
 2664 | 1        | 5            |  2664
 2666 | 1        | 7            |  2666
 2668 | 1        | 9            |  2668
 2674 | 1        | 5            |  2674
 2676 | 1        | 7            |  2676
 2680 | 1        | 1            |  2680
 2700 | 1        | 1            |  2700
 2704 | 1        | 5            |  2704
 2708 | 1        | 9            |  2708
 2718 | 1        | 9            |  2718
 2720 | 1        | 1            |  2720
 2730 | 1        | 1            |  2730
 2732 | 1        | 3            |  2732
 2736 | 1        | 7            |  2736
 2750 | 1        | 1            |  2750
 2778 | 1        | 9            |  2778
 2782 | 1        | 3            |  2782
 2786 | 1        | 7            |  2786
 2800 | 1        | 1            |  2800
 2804 | 1        | 5            |  2804
 2810 | 1        | 1            |  2810
 2816 | 1        | 7            |  2816
 2820 | 1        | 1            |  2820
 2824 | 1        | 5            |  2824
 2826 | 1        | 7            |  2826
 2834 | 1        | 5            |  2834
 2848 | 1        | 9            |  2848
 2850 | 1        | 1            |  2850
 2860 | 1        | 1            |  2860
 2866 | 1        | 7            |  2866
 2874 | 1        | 5            |  2874
 2876 | 1        | 7            |  2876
 2878 | 1        | 9            |  2878
 2880 | 1        | 1            |  2880
 2894 | 1        | 5            |  2894
 2902 | 1        | 3            |  2902
 2908 | 1        | 9            |  2908
 2910 | 1        | 1            |  2910
 2912 | 1        | 3            |  2912
 2924 | 1        | 5            |  2924
 2932 | 1        | 3            |  2932
 2960 | 1        | 1            |  2960
 2966 | 1        | 7            |  2966
 2968 | 1        | 9            |  2968
 2974 | 1        | 5            |  2974
 2976 | 1        | 7            |  2976
 2988 | 1        | 9            |  2988
 2990 | 1        | 1            |  2990
 2998 | 1        | 9            |  2998
 2000 | 1        | 1            |  2000
 2002 | 1        | 3            |  2002
 2006 | 1        | 7            |  2006
 2008 | 1        | 9            |  2008
 2010 | 1        | 1            |  2010
 2012 | 1        | 3            |  2012
 2014 | 1        | 5            |  2014
 2020 | 1        | 1            |  2020
 2024 | 1        | 5            |  2024
 2030 | 1        | 1            |  2030
 2038 | 1        | 9            |  2038
 2042 | 1        | 3            |  2042
 2074 | 1        | 5            |  2074
 2080 | 1        | 1            |  2080
 2082 | 1        | 3            |  2082
 2084 | 1        | 5            |  2084
 2090 | 1        | 1            |  2090
 2094 | 1        | 5            |  2094
 2106 | 1        | 7            |  2106
 2108 | 1        | 9            |  2108
 2110 | 1        | 1            |  2110
 2112 | 1        | 3            |  2112
 2126 | 1        | 7            |  2126
 2134 | 1        | 5            |  2134
 2142 | 1        | 3            |  2142
 2150 | 1        | 1            |  2150
 2152 | 1        | 3            |  2152
 2168 | 1        | 9            |  2168
 2172 | 1        | 3            |  2172
 2178 | 1        | 9            |  2178
 2186 | 1        | 7            |  2186
 2192 | 1        | 3            |  2192
 2196 | 1        | 7            |  2196
 2214 | 1        | 5            |  2214
 2224 | 1        | 5            |  2224
 2230 | 1        | 1            |  2230
 2232 | 1        | 3            |  2232
 2234 | 1        | 5            |  2234
 2238 | 1        | 9            |  2238
 2244 | 1        | 5            |  2244
 2252 | 1        | 3            |  2252
 2256 | 1        | 7            |  2256
 2258 | 1        | 9            |  2258
 2266 | 1        | 7            |  2266
 2268 | 1        | 9            |  2268
 2270 | 1        | 1            |  2270
 2272 | 1        | 3            |  2272
 2274 | 1        | 5            |  2274
 2276 | 1        | 7            |  2276
 2282 | 1        | 3            |  2282
 2286 | 1        | 7            |  2286
 2288 | 1        | 9            |  2288
 2290 | 1        | 1            |  2290
 2292 | 1        | 3            |  2292
 2300 | 1        | 1            |  2300
 2306 | 1        | 7            |  2306
 2312 | 1        | 3            |  2312
 2314 | 1        | 5            |  2314
 2320 | 1        | 1            |  2320
 2326 | 1        | 7            |  2326
 2330 | 1        | 1            |  2330
 2332 | 1        | 3            |  2332
 2344 | 1        | 5            |  2344
 2348 | 1        | 9            |  2348
 2354 | 1        | 5            |  2354
 2358 | 1        | 9            |  2358
 2360 | 1        | 1            |  2360
 2362 | 1        | 3            |  2362
 2366 | 1        | 7            |  2366
 2376 | 1        | 7            |  2376
 2380 | 1        | 1            |  2380
 2386 | 1        | 7            |  2386
 2392 | 1        | 3            |  2392
 2396 | 1        | 7            |  2396
 2400 | 1        | 1            |  2400
 2402 | 1        | 3            |  2402
 2406 | 1        | 7            |  2406
 2416 | 1        | 7            |  2416
 2420 | 1        | 1            |  2420
 2440 | 1        | 1            |  2440
 2454 | 1        | 5            |  2454
 2460 | 1        | 1            |  2460
 2472 | 1        | 3            |  2472
 2474 | 1        | 5            |  2474
 2476 | 1        | 7            |  2476
 2482 | 1        | 3            |  2482
 2484 | 1        | 5            |  2484
 2490 | 1        | 1            |  2490
 2496 | 1        | 7            |  2496
 2510 | 1        | 1            |  2510
 2512 | 1        | 3            |  2512
 2526 | 1        | 7            |  2526
 2528 | 1        | 9            |  2528
 2532 | 1        | 3            |  2532
 2538 | 1        | 9            |  2538
 2544 | 1        | 5            |  2544
 2548 | 1        | 9            |  2548
 2556 | 1        | 7            |  2556
 2560 | 1        | 1            |  2560
 2562 | 1        | 3            |  2562
 2574 | 1        | 5            |  2574
 2578 | 1        | 9            |  2578
 2592 | 1        | 3            |  2592
 2594 | 1        | 5            |  2594
 2596 | 1        | 7            |  2596
 2600 | 1        | 1            |  2600
 2604 | 1        | 5            |  2604
 2610 | 1        | 1            |  2610
 2616 | 1        | 7            |  2616
 2618 | 1        | 9            |  2618
 2624 | 1        | 5            |  2624
 2626 | 1        | 7            |  2626
 2628 | 1        | 9            |  2628
 2640 | 1        | 1            |  2640
 2650 | 1        | 1            |  2650
 2652 | 1        | 3            |  2652
 2658 | 1        | 9            |  2658
 2682 | 1        | 3            |  2682
 2684 | 1        | 5            |  2684
 2692 | 1        | 3            |  2692
 2694 | 1        | 5            |  2694
 2698 | 1        | 9            |  2698
 2710 | 1        | 1            |  2710
 2712 | 1        | 3            |  2712
 2722 | 1        | 3            |  2722
 2726 | 1        | 7            |  2726
 2734 | 1        | 5            |  2734
 2742 | 1        | 3            |  2742
 2748 | 1        | 9            |  2748
 2752 | 1        | 3            |  2752
 2760 | 1        | 1            |  2760
 2768 | 1        | 9            |  2768
 2770 | 1        | 1            |  2770
 2772 | 1        | 3            |  2772
 2774 | 1        | 5            |  2774
 2788 | 1        | 9            |  2788
 2792 | 1        | 3            |  2792
 2808 | 1        | 9            |  2808
 2812 | 1        | 3            |  2812
 2814 | 1        | 5            |  2814
 2818 | 1        | 9            |  2818
 2830 | 1        | 1            |  2830
 2832 | 1        | 3            |  2832
 2838 | 1        | 9            |  2838
 2840 | 1        | 1            |  2840
 2842 | 1        | 3            |  2842
 2858 | 1        | 9            |  2858
 2862 | 1        | 3            |  2862
 2868 | 1        | 9            |  2868
 2872 | 1        | 3            |  2872
 2884 | 1        | 5            |  2884
 2888 | 1        | 9            |  2888
 2890 | 1        | 1            |  2890
 2892 | 1        | 3            |  2892
 2896 | 1        | 7            |  2896
 2898 | 1        | 9            |  2898
 2914 | 1        | 5            |  2914
 2922 | 1        | 3            |  2922
 2926 | 1        | 7            |  2926
 2928 | 1        | 9            |  2928
 2930 | 1        | 1            |  2930
 2940 | 1        | 1            |  2940
 2942 | 1        | 3            |  2942
 2946 | 1        | 7            |  2946
 2954 | 1        | 5            |  2954
 2964 | 1        | 5            |  2964
 2970 | 1        | 1            |  2970
 2980 | 1        | 1            |  2980
 2984 | 1        | 5            |  2984
 2986 | 1        | 7            |  2986
 2992 | 1        | 3            |  2992
(1499 rows)

EXPLAIN (COSTS OFF) UPDATE parent_table SET category='2' WHERE category='1';
                          QUERY PLAN                           
---------------------------------------------------------------
 Update on parent_table
   Update on parent_table_0_list_1_hash_0 parent_table
   Update on parent_table_0_list_1_hash_1 parent_table
   Update on parent_table_0_list_1_hash_2 parent_table
   Update on parent_table_1_list_1_hash_0 parent_table
   Update on parent_table_1_list_1_hash_1 parent_table
   Update on parent_table_1_list_1_hash_2 parent_table
   Update on parent_table_2_list_1_hash_0 parent_table
   Update on parent_table_2_list_1_hash_1 parent_table
   Update on parent_table_2_list_1_hash_2 parent_table
   ->  Global Index Scan using global_index_pt on parent_table
         Index Cond: (category = '1'::text)
(12 rows)

UPDATE parent_table SET category='2' WHERE category='1';
SELECT * FROM parent_table WHERE category='1';
 id | category | sub_category | value 
----+----------+--------------+-------
(0 rows)

ALTER TABLE parent_table DETACH PARTITION parent_table_0;
SELECT indexrelid::regclass, indrelid::regclass, indtoprelid::regclass, indtopindexid::regclass FROM pg_index WHERE indtopindexid::regclass ='global_index_pt'::regclass;
                indexrelid                 |           indrelid           | indtoprelid  |  indtopindexid  
-------------------------------------------+------------------------------+--------------+-----------------
 parent_table_1_category_idx               | parent_table_1               | parent_table | global_index_pt
 parent_table_1_list_1_category_idx        | parent_table_1_list_1        | parent_table | global_index_pt
 parent_table_1_list_1_hash_0_category_idx | parent_table_1_list_1_hash_0 | parent_table | global_index_pt
 parent_table_1_list_1_hash_1_category_idx | parent_table_1_list_1_hash_1 | parent_table | global_index_pt
 parent_table_1_list_1_hash_2_category_idx | parent_table_1_list_1_hash_2 | parent_table | global_index_pt
 parent_table_1_list_2_category_idx        | parent_table_1_list_2        | parent_table | global_index_pt
 parent_table_1_list_2_hash_0_category_idx | parent_table_1_list_2_hash_0 | parent_table | global_index_pt
 parent_table_1_list_2_hash_1_category_idx | parent_table_1_list_2_hash_1 | parent_table | global_index_pt
 parent_table_1_list_2_hash_2_category_idx | parent_table_1_list_2_hash_2 | parent_table | global_index_pt
 parent_table_2_category_idx               | parent_table_2               | parent_table | global_index_pt
 parent_table_2_list_1_category_idx        | parent_table_2_list_1        | parent_table | global_index_pt
 parent_table_2_list_1_hash_0_category_idx | parent_table_2_list_1_hash_0 | parent_table | global_index_pt
 parent_table_2_list_1_hash_1_category_idx | parent_table_2_list_1_hash_1 | parent_table | global_index_pt
 parent_table_2_list_1_hash_2_category_idx | parent_table_2_list_1_hash_2 | parent_table | global_index_pt
 parent_table_2_list_2_category_idx        | parent_table_2_list_2        | parent_table | global_index_pt
 parent_table_2_list_2_hash_0_category_idx | parent_table_2_list_2_hash_0 | parent_table | global_index_pt
 parent_table_2_list_2_hash_1_category_idx | parent_table_2_list_2_hash_1 | parent_table | global_index_pt
 parent_table_2_list_2_hash_2_category_idx | parent_table_2_list_2_hash_2 | parent_table | global_index_pt
(18 rows)

SELECT indexrelid::regclass, indrelid::regclass, indtoprelid::regclass, indtopindexid::regclass FROM pg_index WHERE indtopindexid::regclass ='global_index_pt_0'::regclass;
                  indexrelid                   |           indrelid           |  indtoprelid   |   indtopindexid   
-----------------------------------------------+------------------------------+----------------+-------------------
 parent_table_0_list_1_sub_category_idx        | parent_table_0_list_1        | parent_table_0 | global_index_pt_0
 parent_table_0_list_1_hash_0_sub_category_idx | parent_table_0_list_1_hash_0 | parent_table_0 | global_index_pt_0
 parent_table_0_list_1_hash_1_sub_category_idx | parent_table_0_list_1_hash_1 | parent_table_0 | global_index_pt_0
 parent_table_0_list_1_hash_2_sub_category_idx | parent_table_0_list_1_hash_2 | parent_table_0 | global_index_pt_0
 parent_table_0_list_2_sub_category_idx        | parent_table_0_list_2        | parent_table_0 | global_index_pt_0
 parent_table_0_list_2_hash_0_sub_category_idx | parent_table_0_list_2_hash_0 | parent_table_0 | global_index_pt_0
 parent_table_0_list_2_hash_1_sub_category_idx | parent_table_0_list_2_hash_1 | parent_table_0 | global_index_pt_0
 parent_table_0_list_2_hash_2_sub_category_idx | parent_table_0_list_2_hash_2 | parent_table_0 | global_index_pt_0
(8 rows)

SELECT indexrelid::regclass, indrelid::regclass, indtoprelid::regclass, indtopindexid::regclass FROM pg_index WHERE indtopindexid::regclass ='global_index_pt_l_2'::regclass;
               indexrelid               |           indrelid           |      indtoprelid      |    indtopindexid    
----------------------------------------+------------------------------+-----------------------+---------------------
 parent_table_2_list_2_hash_0_value_idx | parent_table_2_list_2_hash_0 | parent_table_2_list_2 | global_index_pt_l_2
 parent_table_2_list_2_hash_1_value_idx | parent_table_2_list_2_hash_1 | parent_table_2_list_2 | global_index_pt_l_2
 parent_table_2_list_2_hash_2_value_idx | parent_table_2_list_2_hash_2 | parent_table_2_list_2 | global_index_pt_l_2
(3 rows)

EXPLAIN (COSTS OFF) SELECT * FROM parent_table WHERE category='1';
                       QUERY PLAN                        
---------------------------------------------------------
 Global Index Scan using global_index_pt on parent_table
   Index Cond: (category = '1'::text)
(2 rows)

SELECT * FROM parent_table WHERE category='1';
 id | category | sub_category | value 
----+----------+--------------+-------
(0 rows)

ALTER TABLE parent_table ATTACH PARTITION parent_table_0 FOR VALUES FROM (0) to (1000);
SELECT indexrelid::regclass, indrelid::regclass, indtoprelid::regclass, indtopindexid::regclass FROM pg_index WHERE indtopindexid::regclass ='global_index_pt'::regclass;
                indexrelid                 |           indrelid           | indtoprelid  |  indtopindexid  
-------------------------------------------+------------------------------+--------------+-----------------
 parent_table_1_category_idx               | parent_table_1               | parent_table | global_index_pt
 parent_table_1_list_1_category_idx        | parent_table_1_list_1        | parent_table | global_index_pt
 parent_table_1_list_1_hash_0_category_idx | parent_table_1_list_1_hash_0 | parent_table | global_index_pt
 parent_table_1_list_1_hash_1_category_idx | parent_table_1_list_1_hash_1 | parent_table | global_index_pt
 parent_table_1_list_1_hash_2_category_idx | parent_table_1_list_1_hash_2 | parent_table | global_index_pt
 parent_table_1_list_2_category_idx        | parent_table_1_list_2        | parent_table | global_index_pt
 parent_table_1_list_2_hash_0_category_idx | parent_table_1_list_2_hash_0 | parent_table | global_index_pt
 parent_table_1_list_2_hash_1_category_idx | parent_table_1_list_2_hash_1 | parent_table | global_index_pt
 parent_table_1_list_2_hash_2_category_idx | parent_table_1_list_2_hash_2 | parent_table | global_index_pt
 parent_table_2_category_idx               | parent_table_2               | parent_table | global_index_pt
 parent_table_2_list_1_category_idx        | parent_table_2_list_1        | parent_table | global_index_pt
 parent_table_2_list_1_hash_0_category_idx | parent_table_2_list_1_hash_0 | parent_table | global_index_pt
 parent_table_2_list_1_hash_1_category_idx | parent_table_2_list_1_hash_1 | parent_table | global_index_pt
 parent_table_2_list_1_hash_2_category_idx | parent_table_2_list_1_hash_2 | parent_table | global_index_pt
 parent_table_2_list_2_category_idx        | parent_table_2_list_2        | parent_table | global_index_pt
 parent_table_2_list_2_hash_0_category_idx | parent_table_2_list_2_hash_0 | parent_table | global_index_pt
 parent_table_2_list_2_hash_1_category_idx | parent_table_2_list_2_hash_1 | parent_table | global_index_pt
 parent_table_2_list_2_hash_2_category_idx | parent_table_2_list_2_hash_2 | parent_table | global_index_pt
 parent_table_0_category_idx               | parent_table_0               | parent_table | global_index_pt
 parent_table_0_list_1_category_idx        | parent_table_0_list_1        | parent_table | global_index_pt
 parent_table_0_list_1_hash_0_category_idx | parent_table_0_list_1_hash_0 | parent_table | global_index_pt
 parent_table_0_list_1_hash_1_category_idx | parent_table_0_list_1_hash_1 | parent_table | global_index_pt
 parent_table_0_list_1_hash_2_category_idx | parent_table_0_list_1_hash_2 | parent_table | global_index_pt
 parent_table_0_list_2_category_idx        | parent_table_0_list_2        | parent_table | global_index_pt
 parent_table_0_list_2_hash_0_category_idx | parent_table_0_list_2_hash_0 | parent_table | global_index_pt
 parent_table_0_list_2_hash_1_category_idx | parent_table_0_list_2_hash_1 | parent_table | global_index_pt
 parent_table_0_list_2_hash_2_category_idx | parent_table_0_list_2_hash_2 | parent_table | global_index_pt
(27 rows)

SELECT indexrelid::regclass, indrelid::regclass, indtoprelid::regclass, indtopindexid::regclass FROM pg_index WHERE indtopindexid::regclass ='global_index_pt_0'::regclass;
                  indexrelid                   |           indrelid           |  indtoprelid   |   indtopindexid   
-----------------------------------------------+------------------------------+----------------+-------------------
 parent_table_0_list_1_sub_category_idx        | parent_table_0_list_1        | parent_table_0 | global_index_pt_0
 parent_table_0_list_1_hash_0_sub_category_idx | parent_table_0_list_1_hash_0 | parent_table_0 | global_index_pt_0
 parent_table_0_list_1_hash_1_sub_category_idx | parent_table_0_list_1_hash_1 | parent_table_0 | global_index_pt_0
 parent_table_0_list_1_hash_2_sub_category_idx | parent_table_0_list_1_hash_2 | parent_table_0 | global_index_pt_0
 parent_table_0_list_2_sub_category_idx        | parent_table_0_list_2        | parent_table_0 | global_index_pt_0
 parent_table_0_list_2_hash_0_sub_category_idx | parent_table_0_list_2_hash_0 | parent_table_0 | global_index_pt_0
 parent_table_0_list_2_hash_1_sub_category_idx | parent_table_0_list_2_hash_1 | parent_table_0 | global_index_pt_0
 parent_table_0_list_2_hash_2_sub_category_idx | parent_table_0_list_2_hash_2 | parent_table_0 | global_index_pt_0
(8 rows)

SELECT indexrelid::regclass, indrelid::regclass, indtoprelid::regclass, indtopindexid::regclass FROM pg_index WHERE indtopindexid::regclass ='global_index_pt_l_2'::regclass;
               indexrelid               |           indrelid           |      indtoprelid      |    indtopindexid    
----------------------------------------+------------------------------+-----------------------+---------------------
 parent_table_2_list_2_hash_0_value_idx | parent_table_2_list_2_hash_0 | parent_table_2_list_2 | global_index_pt_l_2
 parent_table_2_list_2_hash_1_value_idx | parent_table_2_list_2_hash_1 | parent_table_2_list_2 | global_index_pt_l_2
 parent_table_2_list_2_hash_2_value_idx | parent_table_2_list_2_hash_2 | parent_table_2_list_2 | global_index_pt_l_2
(3 rows)

EXPLAIN (COSTS OFF) SELECT * FROM parent_table WHERE category='1';
                       QUERY PLAN                        
---------------------------------------------------------
 Global Index Scan using global_index_pt on parent_table
   Index Cond: (category = '1'::text)
(2 rows)

SELECT * FROM parent_table WHERE category='1';
 id | category | sub_category | value 
----+----------+--------------+-------
(0 rows)

DROP TABLE parent_table;
